<?xml version="1.0" encoding="UTF-8"?>
<Pedidos xmlns:xsi="http://www.w3.org/2001/XMLSchema-instance" xsi:noNamespaceSchemaLocation="pedido1.xsd">
    <Pedido>
        <cod_sucursal>A9865434</cod_sucursal>
        <nom_trabajador>Francisco Montero Gutierrez</nom_trabajador>
        <fec_pedidos>2020-01-01</fec_pedidos>
        <observaciones>Urgente</observaciones>
        <articulos code="ADE-123">
            <num>12</num>
            <precio>270</precio>
            <observarcion>El artículo llegó en su fecha esperada</observarcion>
            <revision>15</revision>
        </articulos>
    </Pedido>
</Pedidos>